{
  "schema_version": "1.0.0",
  "correlation_id": "11111111-1111-4111-8111-111111111111",
  "source_item_id": "33333333-3333-4333-8333-333333333333",
  "candidate_groups": [
    {
      "candidate_group_id": "44444444-4444-4444-8444-444444444444",
      "candidate_type": "MATCH",
      "claims": [
        {
          "claim_id": "55555555-5555-4555-8555-555555555555",
          "subject_type": "MATCH_PARTICIPANT",
          "subject_candidate_key": "bull-a",
          "field_key": "display_name",
          "value": "Bull A",
          "basis": "EXPLICIT",
          "confidence": 0.99,
          "evidence_refs": ["66666666-6666-4666-8666-666666666666"]
        },
        {
          "claim_id": "77777777-7777-4777-8777-777777777777",
          "subject_type": "MATCH",
          "subject_candidate_key": "match-1",
          "field_key": "winner_candidate_key",
          "value": "bull-a",
          "basis": "EXPLICIT",
          "confidence": 0.96,
          "evidence_refs": ["66666666-6666-4666-8666-666666666666"]
        }
      ],
      "unresolved_fields": ["duration_seconds"],
      "warnings": []
    }
  ],
  "model": {
    "provider": "example-provider",
    "name": "example-model",
    "contract_version": "1.0.0",
    "prompt_version": "extract-match-v1",
    "input_hash": "sha256:example"
  }
}
